{
  "meta": {
    "name": "Regime Pilot",
    "version": "1.0.0",
    "author": "holybunnie",
    "created_at": "2026-06-13T08:00:00Z",
    "description": "Regime-routing strategy. Classifies the market into 4 regimes using percentile-ranked features (BTC realized-vol percentile, Fear & Greed level and 7-day change, and the signature universe-breadth feature), with hysteresis, then runs a per-regime playbook. Position sizing follows the drawdown-budget law with a de-risk ladder. Funding/OI features are omitted because they are not available on the current CMC data tier (see ASSUMPTIONS.md). Pre-registered grid (configurations_tried): persistence in {4,8,12} x k in {0.3,0.5,0.7} x breadth-high threshold in {55,60,65} = 27.",
    "configurations_tried": 27
  },
  "universe": {
    "source": "eligible_list",
    "max_market_cap_rank": 50,
    "min_volume_24h_usd": 5000000
  },
  "features": [
    {"name": "breadth_30d", "source": "price", "transform": {"kind": "breadth", "threshold_kind": "above_mean", "threshold_window": 720}},
    {"name": "breadth_pct", "source": "price", "transform": {"kind": "breadth", "threshold_kind": "above_mean", "threshold_window": 720, "rank_window": 2160}},
    {"name": "fg_level", "source": "fear_greed", "transform": {"kind": "raw"}},
    {"name": "fg_delta_7d", "source": "fear_greed", "transform": {"kind": "delta", "window": 168}},
    {"name": "btc_vol", "source": "btc_price", "transform": {"kind": "realized_vol", "window": 168}},
    {"name": "btc_vol_pct", "source": "btc_price", "transform": {"kind": "realized_vol", "window": 168, "rank_window": 2160}}
  ],
  "regimes": [
    {
      "name": "capitulation",
      "persistence_hours": 8,
      "predicate": {
        "op": "and",
        "args": [
          {"op": "<", "left": {"feature": "fg_level"}, "right": {"const": 20}},
          {"op": ">", "left": {"feature": "btc_vol_pct"}, "right": {"const": 80}}
        ]
      }
    },
    {
      "name": "crowded_fragile",
      "persistence_hours": 8,
      "predicate": {
        "op": "and",
        "args": [
          {"op": ">", "left": {"feature": "fg_level"}, "right": {"const": 80}},
          {"op": ">", "left": {"feature": "btc_vol_pct"}, "right": {"const": 60}}
        ]
      }
    },
    {
      "name": "trend_up",
      "persistence_hours": 8,
      "predicate": {
        "op": "and",
        "args": [
          {"op": ">", "left": {"feature": "breadth_pct"}, "right": {"const": 60}},
          {"op": "<", "left": {"feature": "btc_vol_pct"}, "right": {"const": 70}},
          {"op": ">", "left": {"feature": "fg_delta_7d"}, "right": {"const": 0}}
        ]
      }
    },
    {
      "name": "chop",
      "persistence_hours": 4,
      "predicate": {"const_bool": true}
    }
  ],
  "playbooks": {
    "trend_up": {
      "action": "hold_assets",
      "select": {"rank_by": "volume_24h", "top_n": 5},
      "min_hold_hours": 4
    },
    "crowded_fragile": {"action": "flat"},
    "capitulation": {
      "action": "staged_reentry",
      "assets": ["BTC", "BNB"],
      "reentry_feature": "fg_level",
      "min_hold_hours": 4
    },
    "chop": {"action": "flat"}
  },
  "sizing": {
    "k": 0.5,
    "vol_target_annual": 0.20,
    "asset_vol_feature": "btc_vol",
    "max_position_weight": 0.4
  },
  "risk": {
    "max_drawdown_budget": 0.20,
    "per_asset_cap": 0.25,
    "max_gross_exposure": 1.0,
    "derisk_ladder": [
      {"budget_consumed": 0.5, "gross_exposure_multiplier": 0.5},
      {"budget_consumed": 0.75, "gross_exposure_multiplier": 0.0, "except_regimes": ["capitulation"]},
      {"budget_consumed": 0.9, "gross_exposure_multiplier": 0.0}
    ]
  },
  "costs": {
    "fee_bps": 10,
    "slippage_bps_floor": 5,
    "slippage_size_coeff": 50,
    "latency_minutes": 60
  }
}
